Model,MAE,MSE,RMSE,R2,Comments,Execution Time,Run At
Prophet,28.05195868470978,1184.7415783156716,34.42007522239996,-0.0667343802333793,First Model Run,0.809762716293335,20250515_131629
Prophet,0.0280377614288651,0.0011837267688077,0.0344053305289708,-0.0658206516943271,All attributes Model Run,0.6825180053710938,20250515_132216
Prophet,0.0526867495387486,0.004819825071045,0.0694249600003132,-0.2935977107425853,All attributes with -ve values for Price Model Run,0.6430001258850098,20250515_132319
Prophet,0.0456252671706689,0.003520963149011,0.0593377042782332,0.0550051501802539,All data with hyperparameter tuning Model Run,0.3985352516174316,20250515_132909
Prophet,0.0526867495387486,0.004819825071045,0.0694249600003132,-0.2935977107425853,Saving the Model Run,0.7751479148864746,20250515_134812
Prophet,0.0295739018596769,0.0015998778513918,0.039998473113256,0.0500477909185876,With defined train and test period,0.5487091541290283,20250515_161327
Prophet,0.0332251200955366,0.002075783202753,0.0455607638517292,-0.2325283691588262,With defined train and test period tuned with hyperparameters,0.4035801887512207,20250515_161609
Prophet,0.0332251200955366,0.0020757832027530417,0.04556076385172928,-0.23252836915882624,Saving model with hyperparameter tuning Model Run,0.39842891693115234,20250515_161810
